"codeID","code","selfirst","seltext","selend","fileID"
15,"academic achievements",32386,"7.2 	assegurar que:  
7.2.1 no quinto ano de vigência do PEE-MS, pelo menos 70% dos(as) estudantes do ensino fundamental e do ensino médio tenham alcançado nível suficiente de aprendizado em relação aos direitos e objetivos de aprendizagem e desenvolvimento de seu ano de estudo, e pelo menos 50%, o nível desejável; 
7.2.2 no último ano de vigência do PEE-MS, todos(as) os(as) estudantes do ensino fundamental e do ensino médio tenham alcançado nível suficiente de aprendizado em relação aos direitos e objetivos de aprendizagem e desenvolvimento de seu ano de estudo e pelo menos 80%, o nível desejável; ",32992,77
80,"training in education management",81568,"16.13. implementar, nos sistemas de ensino, a formação inicial e continuada do pessoal técnico e administrativo, a partir da vigência do PEE-MS; 
16.14. promover e garantir a formação inicial e continuada em nível médio para 100% do pessoal técnico e administrativo, e em nível superior para 50% desses profissionais, na vigência do PEE-MS.  ",81910,77
33,"trainning courses",80719,"16.10. fortalecer a formação dos(as) professores(as) das escolas públicas de educação básica, por meio da implementação das ações do Plano Nacional do Livro e Leitura, e de participação em programa nacional de disponibilização de recursos para acesso a bens culturais pelo magistério público;  ",81013,77
90,"promote democratic/public participation",33181,"7.4 constituir, em regime de colaboração com os entes federados, um conjunto de indicadores de avaliação institucional com base no perfil do alunado e do corpo de profissionais da educação, nas condições de infraestrutura das escolas, nos recursos pedagógicos disponíveis, nas características da gestão e em outras dimensões relevantes, até o quinto ano de vigência do PEE-MS;  
7.5 promover, anualmente, a autoavaliação das escolas de educação básica, por meio da constituição de instrumentos de avaliação que orientem as dimensões a serem fortalecidas, destacando-se a elaboração de planejamento estratégico, a melhoria contínua da qualidade educacional, a formação continuada dos profissionais da educação e o aprimoramento da gestão democrática;  ",33932,77
108,"physical school infrastructure",33933,"7.6 formalizar e executar os planos de ações articuladas, dando cumprimento às metas de qualidade estabelecidas para a educação básica pública e às estratégias de apoio técnico e financeiro voltadas à melhoria da gestão educacional, à formação de professores(as) e profissionais de serviços e apoio escolares, à ampliação e ao desenvolvimento de recursos pedagógicos e à melhoria  e expansão da infraestrutura física da rede escolar, como bibliotecas, auditórios e laboratórios, com acessibilidade, dentre outros; ",34447,77
15,"academic achievements",35542,"7.12 apoiar a incorporação do exame nacional do ensino médio ao sistema de avaliação da educação básica; ",35647,77
129,"dissemination of actions/programs",35353,"7.11 acompanhar e divulgar, bienalmente, os resultados pedagógicos dos indicadores do sistema estadual de avaliação da educação básica nas páginas eletrônicas das instituições de ensino;",35539,77
140,"participation in nacional assessment",34698,"7.8 aplicar os instrumentos nacionais de avaliação da qualidade do ensino fundamental e do ensino médio, na vigência do PEE-MS; 
7.9 elaborar e aplicar os instrumentos de avaliação estaduais, considerando as especificidades e a diversidade sociocultural nas etapas do ensino fundamental e do ensino médio, englobando todas as áreas de conhecimento na avaliação dos anos finais do ensino fundamental, na vigência do PEEMS, e promover sua permanente adequação; 
7.10 utilizar os resultados das avaliações nacionais e estaduais pelos sistemas de ensino e pelas escolas para a melhoria de seus processos e práticas pedagógicas, durante a execução do PEE-MS; ",35352,77
141,"promote open-source software",36454,"7.16 aprimorar a qualidade dos recursos tecnológicos que garantam a utilização dos softwares livres, por meio das ferramentas disponíveis na internet, com equipamentos que acompanhem o desenvolvimento tecnológico, até o terceiro ano de vigência deste PEE; ",36710,77
112,"social equality/assistence program",36711,"7.17 assegurar transporte gratuito, acessível e seguro para todos(as) os(as) estudantes da educação do campo, populações fronteiriças, comunidades quilombolas e indígenas, e povos das águas, mediante renovação e padronização integral da frota de veículos, de acordo com as especificações definidas pelo órgão competente, e financiamento compartilhado, visando reduzir a evasão escolar e o tempo médio de deslocamento da casa até a escola e vice-versa, até o quinto ano de vigência deste PEE-MS;  ",37207,77
86,"use of tech in pedag practices",36140,"7.15 garantir, até o quinto ano de vigência do PEE-MS, estruturas necessárias e promover a utilização das tecnologias educacionais para todas as etapas da educação básica, com incentivo às práticas pedagógicas inovadoras, visando à melhoria do fluxo escolar e da aprendizagem, com acompanhamento dos resultados;  ",36453,77
140,"participation in nacional assessment",35844,"7.14 orientar, acompanhar e avaliar as políticas das redes públicas de ensino, a fim de atingir as metas do IDEB, reduzindo pela metade, até o último ano de vigência deste PEE, a diferença entre as escolas com os menores índices e a média nacional, de forma a garantir equidade da aprendizagem; ",36139,77
112,"social equality/assistence program",37208,"7.18 desenvolver propostas alternativas de atendimento escolar para a populações do campo,  fronteiriças, quilombolas, indígenas e povos das águas, que considerem as especificidades culturais e locais e as boas práticas nacionais e internacionais, nos três primeiros anos de vigência do PEEMS; ",37502,77
77,"internet infrastructure in schools",37504,"7.19 universalizar, até o terceiro ano de vigência do PEE-MS, o acesso à rede mundial de computadores, em banda larga de alta velocidade, em todas as unidades de educação básica;   ",37685,77
86,"use of tech in pedag practices",37686,"7.20 	ampliar, até o quinto ano de vigência do PEE-MS, a relação computador/aluno nas escolas da rede púbica de educação básica, promovendo a utilização pedagógica das tecnologias da informação e da comunicação;",37897,77
90,"promote democratic/public participation",37900,"7.21 garantir a participação da comunidade escolar no planejamento, na aplicação e no controle de recursos financeiros advindos de transferência direta às escolas, visando à ampliação da transparência e ao efetivo desenvolvimento da gestão democrática, a partir da vigência do PEE-MS;   ",38187,77
24,"distribute equipment for teaching",38986,"7.26 participar de programa nacional de reestruturação e aquisição de equipamentos para escolas públicas, visando à equalização regional das oportunidades educacionais;  ",39156,77
108,"physical school infrastructure",38188,"7.22 aprimorar o atendimento ao(à) estudante em todas as etapas da educação básica, por meio de programas suplementares de material didático-escolar, transporte, alimentação e assistência à saúde;  
7.23 garantir, em regime de colaboração, às escolas públicas de educação básica o acesso à energia elétrica, ao abastecimento de água, ao esgoto sanitário e ao manejo de resíduos sólidos, na vigência do PEE-MS; ",38598,77
24,"distribute equipment for teaching",39319,"7.28 adquirir equipamentos e recursos tecnológicos, com apoio da União, para utilização pedagógica em todas as escolas públicas da educação básica, assegurada sua manutenção e atualização;  ",39509,77
77,"internet infrastructure in schools",39510,"7.29 criar mecanismos para implementação das condições necessárias à universalização das bibliotecas, com acesso à internet em banda larga, até o quinto ano de vigência deste PEE-MS; ",39693,77
80,"training in education management",40278,"7.32 implementar programa de formação inicial e continuada para o pessoal técnico das secretarias de educação;  
7.33 implantar e desenvolver, até o segundo ano de vigência do PEE-MS, políticas de prevenção e combate à violência  nas escolas, com capacitação dos profissionais da educação para atuarem em ações preventivas junto aos (às) estudantes na detecção das causas como: violência doméstica e sexual, questões étnico-raciais, de gênero e de orientação sexual, para a adoção das providências adequadas, promovendo e garantindo a cultura de paz e um ambiente escolar dotado de segurança para a comunidade;  
7.34 promover e garantir a formação continuada dos profissionais da educação, incluindo gestores e servidores das secretarias de educação, sobre: direitos humanos, promoção da saúde e prevenção das DST/Aids, alcoolismo e drogas, em sua interface com as questões de gênero e sexualidade, questões étnico-raciais, geracionais, situação das pessoas com deficiência, na vigência do PEE-MS;  ",41278,77
112,"social equality/assistence program",41279,"7.35 elaborar e distribuir, em parceria com os órgãos competentes, material didático para educadores(as), estudantes e pais e/ou responsáveis sobre: direitos humanos, promoção da saúde e prevenção das DST/Aids, alcoolismo e drogas, em sua interface com as questões de gênero e sexualidade, questões étnico-raciais e geracionais;",41607,77
112,"social equality/assistence program",42160,"7.38 consolidar, até o quinto ano de vigência do PEE-MS, a oferta, com qualidade social, da educação escolar à população do campo, povos das águas, comunidades fronteiriças, populações itinerantes e comunidades indígenas e quilombolas, respeitando a articulação entre os ambientes escolares e comunitários, assegurando:  
7.38.1 o desenvolvimento sustentável e a preservação da identidade cultural dessas populações;  
7.38.2 a participação da comunidade na definição do modelo de organização pedagógica e de gestão das instituições, consideradas as práticas socioculturais e as formas particulares de organização do tempo;  
7.38.3 a oferta bilíngue da educação infantil e nos anos iniciais do ensino fundamental, em língua materna das comunidades indígenas e em língua portuguesa, 
7.38.4 a reestruturação e a aquisição de equipamentos;  
7.38.5 a oferta de programa para a formação inicial e continuada de profissionais da educação; e 
7.38.6 o atendimento em educação especial;  ",43143,77
104,"training in teaching literacy",43144,"7.39 desenvolver ações efetivas visando à formação de leitores(as) e à capacitação de professores(as), bibliotecários(as), auxiliares/assistentes em biblioteca e agentes da comunidade para atuarem como mediadores(as) da leitura, de acordo com a especificidade das diferentes etapas do desenvolvimento e da aprendizagem, a partir do segundo ano da vigência do PEE-MS;  ",43512,77
131,"promote extracurricular activities",43513,"7.40 promover a integração das escolas com instituições e movimentos culturais, a fim de garantir a oferta regular de atividades culturais para a livre fruição dos(as) estudantes dentro e fora dos espaços escolares, assegurando que as escolas se tornem polos de criação e difusão cultural, no prazo de um ano de vigência do PEE-MS;  ",43846,77
112,"social equality/assistence program",43998,"7.42 promover, até o segundo ano de vigência do PEE-MS, a articulação dos programas da área da educação, de âmbito local e nacional, com os de outras áreas tais como saúde, trabalho e emprego, assistência social, esporte e cultura, possibilitando a criação de redes de apoio integral às famílias, em especial nas áreas de maior  vulnerabilidade  social,  como  condição para a melhoria da qualidade educacional;  ",44411,77
137,"promote healtly programs",44412,"7.43 universalizar, mediante articulação entre os órgãos responsáveis pelas áreas da saúde e da educação, o atendimento aos(às) estudantes da rede escolar pública de educação básica, por meio de ações de prevenção, promoção e atenção à saúde;  
7.44 estabelecer ações efetivas especificamente voltadas para a promoção, prevenção, atenção e atendimento à saúde e à integridade física, mental e emocional dos profissionais da educação, como condição para a melhoria da qualidade educacional, a partir do segundo ano de vigência do PEE-MS;  ",44950,77
117,"provide financial resources",44951,"7.45 	fortalecer, com a colaboração  técnica  e financeira da União, o sistema estadual de avaliação da educação básica, com participação das escolas públicas e privadas, para orientar e redimensionar as políticas públicas, o planejamento  e  as práticas pedagógicas, com o repasse das informações às escolas e à sociedade, nos dois primeiros anos de vigência do PEE-MS ",45321,77
90,"promote democratic/public participation",45670,"7.48 propiciar e fomentar discussões e mobilizar a sociedade para a aprovação da Lei de Responsabilidade Educacional (LRE), pelo Congresso Nacional;  
7.49 criar, no âmbito dos fóruns de educação, o Observatório do PEE-MS, para monitorar o cumprimento das  metas e estratégias estabelecidas neste PEE, mantendo-o atualizado e promovendo a divulgação dos resultados à sociedade;  ",46049,77
88,"promote learning in right age",46313,"8.1 garantir aos estudantes em situação de distorção idade-série, programas com metodologia específica, acompanhamento pedagógico individualizado, recuperação e progressão parcial, visando à continuidade da escolarização, de forma a concluir seus estudos, utilizando-se também da educação a distância, a partir do segundo ano de vigência deste PEE; ",46662,77
112,"social equality/assistence program",46900,"8.3 promover, na vigência do PEE-MS, a busca ativa de jovens fora da escola pertencentes aos segmentos populacionais considerados, bem como aos indígenas, quilombolas, povos das águas, populações fronteiriças, em parceria com as áreas de assistência social, organizações não governamentais, saúde e proteção à juventude;  ",47222,77
68,"partnership with private institutions",47370,"8.5 estabelecer articulação com entidades privadas de serviço social e de formação profissional para expandir, por meio de parcerias, a oferta gratuita da educação profissional na forma concomitante ao ensino cursado pelo estudante na rede escolar pública, a partir do segundo ano de vigência deste PEE-MS;",47676,77
94,"assess literacy education",48457,"9.1. formular e implementar políticas de erradicação do analfabetismo, em parceria com instituições da sociedade civil organizada, na vigência do PEE-MS;  ",48612,77
119,"meet education demand",48613,"9.2. realizar, continuamente, chamadas públicas regulares para educação de jovens e adultos, em regime de colaboração entre os entes federados e em parceria com organizações da sociedade civil;  ",48808,77
142,"identification of target-population",48809,"9.3. realizar levantamento da população de jovens e adultos fora da escola, a partir dos 18 anos de idade, com vistas à implantação diversificada de políticas públicas, em parceria com órgãos competentes, no prazo de dois anos de vigência deste PEE-MS; ",49062,77
88,"promote learning in right age",49064,"9.4. assegurar a oferta gratuita da EJA a todos que não tiveram acesso à educação básica na idade própria, utilizando-se, também, da educação a distância, na vigência do PEE-MS;  ",49243,77
142,"identification of target-population",49390,"9.6. implementar estudos e pesquisas sobre a população da EJA, em parceria com as IES públicas e fóruns de educação, para subsidiar as políticas para essa modalidade, a partir da vigência deste PEE;  ",49590,77
112,"social equality/assistence program",49591,"9.7. apoiar e acompanhar o programa nacional de transferência de renda para jovens e adultos que frequentarem regularmente as aulas e apresentarem rendimento escolar em cursos de alfabetização;  ",49786,77
68,"partnership with private institutions",78446,"16.1. planejar e oferecer, em parceria com as IES públicas e privadas, cursos presenciais e/ou a distância, em calendários diferenciados, que facilitem e garantam, aos(às) docentes em exercício, a formação continuada nas diversas áreas de ensino, a partir do primeiro ano de vigência do PEE-MS;  ",78742,77
11,"partnership with public institutions",78446,"16.1. planejar e oferecer, em parceria com as IES públicas e privadas, cursos presenciais e/ou a distância, em calendários diferenciados, que facilitem e garantam, aos(às) docentes em exercício, a formação continuada nas diversas áreas de ensino, a partir do primeiro ano de vigência do PEE-MS;  ",78742,77
68,"partnership with private institutions",78743,"16.2. articular com as  IES públicas e privadas a oferta, na sede e/ou fora dela, de cursos de formação continuada, presenciais e/ou a distância, com calendários diferenciados, para educação especial, gestão escolar, educação de jovens e adultos, educação infantil, educação escolar indígena, educação no campo, educação escolar quilombola e educação e gênero, a partir do primeiro ano de vigência do PEE-MS;  ",79153,77
112,"social equality/assistence program",50036,"9.9. promover ações de atendimento aos(às) estudantes da educação de jovens e adultos por meio de programas suplementares de transporte, alimentação e saúde, em articulação com as áreas de saúde e de assistência social, na vigência do PEE-MS;  ",50280,77
119,"meet education demand",50281,"9.10. assegurar a oferta da EJA, nas etapas do ensino fundamental e do ensino médio, às pessoas privadas de liberdade nos estabelecimentos penais, garantindo formação específica dos(as) professores(as) e a utilização inclusive da educação a distância, até 2019;  ",50544,77
33,"trainning courses",50545,"9.11. realizar formação continuada dos(as) professores(as) de EJA, incentivando a permanência desses profissionais nessa modalidade;  ",50679,77
117,"provide financial resources",50680,"9.12. desenvolver e apoiar, técnica e financeiramente, projetos inovadores de EJA, com a utilização da educação a distância, que atendam às necessidades específicas desses(as) estudantes, em parceria com instituições da sociedade civil organizada, na vigência do PEE-MS;   ",50953,77
68,"partnership with private institutions",50954,"9.13. promover a articulação com empresas públicas e privadas para oferta das ações de alfabetização e programas permanentes de EJA nessas empresas, com o apoio das tecnologias de informação e comunicação e da educação a distância e a flexibilidade na oferta de acordo com o ritmo do(a) estudante, no prazo de dois anos de vigência deste PEE; ",51297,77
11,"partnership with public institutions",50954,"9.13. promover a articulação com empresas públicas e privadas para oferta das ações de alfabetização e programas permanentes de EJA nessas empresas, com o apoio das tecnologias de informação e comunicação e da educação a distância e a flexibilidade na oferta de acordo com o ritmo do(a) estudante, no prazo de dois anos de vigência deste PEE; ",51297,77
119,"meet education demand",51494,"9.15. oferecer cursos de EJA em horários alternativos, de acordo com a demanda local, de forma que os(as) estudantes possam retomar e prosseguir os seus estudos; ",51656,77
50,"external assessments",51657,"9.16. exercer, continuamente, controle social e fiscalização sobre a qualidade dos cursos de EJA, por meio de avaliação institucional interna e externa;  ",51811,77
143,"establish quality parameters",51812,"9.17. estabelecer padrões mínimos de qualidade para os cursos de EJA, nas etapas do ensino fundamental e do ensino médio, no prazo de dois anos de vigência deste PEE-MS; ",51982,77
123,"develop mechanism for school permance",51983,"9.18. acompanhar e monitorar o acesso e a permanência dos jovens e adultos nos cursos de EJA, nas etapas do ensino fundamental e do ensino médio;  ",52130,77
128,"reestructuring learning content",52448,"9.21. promover cursos específicos para a oferta de cursos de EJA aos idosos, com currículos e metodologias diferenciadas, elaborados em parcerias com as instituições de educação superior, bem como material didático adequado e aulas de tecnologias, a partir da vigência deste PEE. ",52728,77
98,"assess education quality",52131,"9.19. fomentar, na vigência do PEE-MS, o acesso dos(as) estudantes de EJA ao ensino superior, por meio de políticas de apoio;  
9.20. utilizar os recursos e metodologias da educação a distância, atendendo os padrões de qualidade e a legislação vigente, na oferta de cursos de EJA, a partir da vigência deste PEE-MS; ",52447,77
144,"promote student graduation",52756,"10.1 implementar os programas de jovens e adultos do ensino fundamental, oferecendo no mesmo espaço, a formação profissional inicial, com estímulo à conclusão dessa etapa, em parceria com a comunidade local e instituições que atuam no mundo do trabalho, a partir da vigência deste PEE-MS; ",53045,77
33,"trainning courses",53459,"10.3 	promover formação inicial de docentes para atuação nos cursos de EJA integrada à educação profissional, na vigência do PEE-MS;  
10.4 realizar cursos presenciais e a distância de formação continuada aos docentes que atuam na educação de jovens e adultos integrada à educação profissional, a partir do segundo ano de vigência deste PEE;  ",53802,77
117,"provide financial resources",53803,"10.5 prover as escolas que oferecem EJA com condições materiais, infraestrutura adequada e recursos financeiros, que subsidiem a execução de programas específicos, até o terceiro ano de vigência do PEE-MS;  ",54010,77
108,"physical school infrastructure",53803,"10.5 prover as escolas que oferecem EJA com condições materiais, infraestrutura adequada e recursos financeiros, que subsidiem a execução de programas específicos, até o terceiro ano de vigência do PEE-MS;  ",54010,77
119,"meet education demand",54011,"10.6 expandir, na vigência do PEE-MS, as matrículas na educação de jovens e adultos, de modo a articular a formação inicial e continuada de trabalhadores(as) com a educação profissional, objetivando a elevação do nível de escolaridade do(a) trabalhador(a);  
10.7 ampliar a oferta de cursos de EJA, nas etapas dos ensinos fundamental e médio, integrado com a educação profissional, incluindo jovens e adultos com deficiência e baixo nível de escolaridade, a partir  da vigência deste PEE;   ",54502,77
128,"reestructuring learning content",54503,"10.8  organizar, em parceria com as universidades, currículos diversificados para a EJA, nas etapas dos ensinos fundamental e médio, voltados à formação do cidadão para o trabalho, ciência, tecnologia e cultura, respeitadas as normas educacionais vigentes e considerados os saberes dos(as) estudantes trabalhadores(as), a partir do segundo ano de vigência deste PEE-MS;  ",54874,77
18,"production of learning contents",54875,"10.9 fomentar e assegurar, em parceria com as universidades, a produção de material didático, o desenvolvimento de currículos e metodologias específicas, os instrumentos de avaliação e o acesso a equipamentos e laboratórios das redes públicas que oferecem EJA integrada à educação profissional, na vigência deste PEE;  ",55194,77
112,"social equality/assistence program",55195,"10.10 participar do programa nacional de assistência ao(à) estudante, com a promoção de ações de assistência social, financeira e de apoio psicopedagógico que contribuam para garantir o acesso, a permanência, a aprendizagem e a conclusão com êxito da educação de jovens e adultos integrada à educação profissional, a partir do segundo ano de vigência do PEE-MS.  ",55558,77
11,"partnership with public institutions",55887,"11.1. estabelecer parcerias com a rede federal de ensino para o desenvolvimento da educação profissional técnica de nível médio, com vistas à expansão de matrículas, a partir do primeiro ano de vigência deste PEE; ",56101,77
119,"meet education demand",56102,"11.2. expandir a oferta da educação profissional técnica de nível médio na rede pública estadual de ensino, por meio de cursos voltados às demandas regionais, a partir da vigência do PEE-MS;  ",56294,77
90,"promote democratic/public participation",56295,"11.3. oferecer cursos de educação profissional técnica de nível médio, na modalidade educação a distância, com a finalidade de ampliar a oferta e democratizar o acesso à educação profissional pública e gratuita, com padrão de qualidade, a partir do primeiro ano de vigência deste PEE;  ",56581,77
143,"establish quality parameters",56919,"11.5. implantar programa de avaliação da qualidade da educação profissional técnica de nível médio nas instituições integrantes do Sistema Estadual de Ensino, até o segundo ano de vigência do 
	PEE-MS; 	 ",57123,77
112,"social equality/assistence program",57124,"11.6. oferecer cursos de ensino médio gratuito integrado à educação profissional para as populações do campo, comunidades indígenas e quilombolas, povos das águas e para a educação especial, por meio de projetos específicos, incluindo a educação a distância, com vistas a atender os interesses e as necessidades dessas populações, a partir do primeiro ano de vigência deste PEE; ",57503,77
